{"artifactId":"7eb86bd1-6a4c-48f1-bc1a-2266bff533ea","createdUtc":"2026-03-23T11:00:21.0749621\u002B00:00","displayName":"phase3-sample","fileDigests":[{"path":"phase3-sample.png","role":"projection","sha256":"c84bbe2f061783b3c40b8ae23b05afc2eaf0665ef80b7d4e703a2f9bffa2d0ca"},{"path":"phase3-sample.layer-map.json","role":"layer-map","sha256":"0c6bb83d1fc6c5ae0738b96635fd605f719b0d6459f25cce74086b29da8f74b3"},{"path":"phase3-sample.trust-envelope.json","role":"trust-envelope","sha256":"b90c9e6eb84de3ad8cc68aefd8b1cc865687e06bfb18c4c375c76d0253afc29b"},{"path":"phase3-sample.transform-history.json","role":"transform-history","sha256":"a71eb640428a08413406b611453fa164f4885f395466147e6b01df22b2eb10a5"},{"path":"phase3-sample.depth-field.json","role":"depth-field","sha256":"508f6fcb4268f65f2d3575823dbb61052c4866d47a15ba0326ff8ce9bf6f19f8"},{"path":"phase3-sample.universe-layer.json","role":"universe-layer","sha256":"524302d19fd8673a9fdb8ead451f41c881b4da8e2f5d5a35f0f07e2282365819"},{"path":"phase3-sample.gluing-manifest.json","role":"gluing-manifest","sha256":"5d314486c715f1eeecb76dac549ee3785720b1cd0b98b32d1d7f98287d073b68"},{"path":"phase3-sample.projection-rules.json","role":"projection-rules","sha256":"7ad6ac2e1f232d4f75cc3d07c6d6b184607bfe9ee5beda2ddcf599cfe71891ff"},{"path":"phase3-sample.legibility-profile.json","role":"legibility-profile","sha256":"f4b0db35e0729fa3fa0537b1706ea25b6974c2bc7f022d5d6a74840e960f3b30"},{"path":"phase3-sample.event-slices.json","role":"event-slices","sha256":"01e2c5b7afbeb6c11ce99243aeea97cd2adff8a832eb4d84d0babf3924cad90a"},{"path":"phase3-sample.phase-slices.json","role":"phase-slices","sha256":"5bb49a27322182e7d37798b1142bcb32d4258f38e1b39faecf249f2d1855b431"},{"path":"phase3-sample.phase-policy.json","role":"phase-policy","sha256":"64281534585a3da55753b9aaa7eaa160af0cc49267a5018ad030a33806fd2525"},{"path":"phase3-sample.optical-channels.json","role":"optical-channels","sha256":"1d44c5b33d06a548f0e3bf2796ce1b0f81340a41f07e573a157a34bdef95481e"}],"phaseReservations":["oan.hopng_perspectival_engram","oan.hopng_participatory_engram","oan.hopng_peral_universe_set","oan.hopng_modal_transform","oan.hopng_formation_contract","oan.identity_review_delta","oan.cert_acceptance_record","oan.module_self_base_set","oan.commitment_projection","oan.role_glyphic_act","oan.oe_chain_boundary","oan.hopng_role_header","oan.hopng_role_endcap"],"projectionFile":"phase3-sample.png","schema":"oan.hopng_manifest","schemaVersion":"0.1.0","sidecars":[{"path":"phase3-sample.layer-map.json","required":true,"role":"layer-map","schema":"oan.hopng_layer_map","schemaVersion":"0.1.0"},{"path":"phase3-sample.trust-envelope.json","required":true,"role":"trust-envelope","schema":"oan.hopng_trust_envelope","schemaVersion":"0.1.0"},{"path":"phase3-sample.transform-history.json","required":true,"role":"transform-history","schema":"oan.hopng_transform_history","schemaVersion":"0.1.0"},{"path":"phase3-sample.depth-field.json","required":true,"role":"depth-field","schema":"oan.hopng_depth_field","schemaVersion":"0.1.0"},{"path":"phase3-sample.hash.json","required":true,"role":"hash","schema":"oan.hopng_hash_set","schemaVersion":"0.1.0"},{"path":"phase3-sample.signature.json","required":true,"role":"signature","schema":"oan.hopng_signature","schemaVersion":"0.1.0"},{"path":"phase3-sample.universe-layer.json","required":true,"role":"universe-layer","schema":"oan.hopng_universe_layer","schemaVersion":"0.1.0"},{"path":"phase3-sample.gluing-manifest.json","required":true,"role":"gluing-manifest","schema":"oan.hopng_gluing_manifest","schemaVersion":"0.1.0"},{"path":"phase3-sample.projection-rules.json","required":true,"role":"projection-rules","schema":"oan.hopng_projection_rules","schemaVersion":"0.1.0"},{"path":"phase3-sample.legibility-profile.json","required":true,"role":"legibility-profile","schema":"oan.hopng_legibility_profile","schemaVersion":"0.1.0"},{"path":"phase3-sample.event-slices.json","required":true,"role":"event-slices","schema":"oan.hopng_event_slice","schemaVersion":"0.1.0"},{"path":"phase3-sample.phase-slices.json","required":true,"role":"phase-slices","schema":"oan.hopng_phase_slice","schemaVersion":"0.1.0"},{"path":"phase3-sample.phase-policy.json","required":true,"role":"phase-policy","schema":"oan.hopng_phase_policy","schemaVersion":"0.1.0"},{"path":"phase3-sample.optical-channels.json","required":true,"role":"optical-channels","schema":"oan.hopng_optical_channels","schemaVersion":"0.1.0"}],"visibilityPolicy":{"approvedMetadataFields":["artifactId","displayName","createdUtc","projectionFile"],"crypticPointersAllowed":true,"crypticReferences":[],"machineReadableLayersAllowed":true,"primeSafeProjection":true}}