{"artifactId":"c8a81129-2a59-43c9-8332-b7af4085f5aa","createdUtc":"2026-03-30T07:03:41.1921357\u002B00:00","displayName":"phase3-peer-sample","fileDigests":[{"path":"phase3-peer-sample.png","role":"projection","sha256":"c84bbe2f061783b3c40b8ae23b05afc2eaf0665ef80b7d4e703a2f9bffa2d0ca"},{"path":"phase3-peer-sample.layer-map.json","role":"layer-map","sha256":"20a2e042c3685858462064495f95b5ad65ad427c4007f650da1ac89775509814"},{"path":"phase3-peer-sample.trust-envelope.json","role":"trust-envelope","sha256":"8e955fce02683876f5238405017f37c7446b1a51eb7d9369cb8b69c35c1a5069"},{"path":"phase3-peer-sample.transform-history.json","role":"transform-history","sha256":"b3bb8c8ffbe084e4261619dab38594796450b364f15b186b1bd4c65eea3663a9"},{"path":"phase3-peer-sample.depth-field.json","role":"depth-field","sha256":"5a3a28b0778708c16a0682083a838711844512c18548a185d2e53c49ff27f97f"},{"path":"phase3-peer-sample.universe-layer.json","role":"universe-layer","sha256":"d59c8246f5dc0c63b7215ff3bde24373a209f0b6b5e725754b513156afe86dda"},{"path":"phase3-peer-sample.gluing-manifest.json","role":"gluing-manifest","sha256":"47dc06dd0d07b8ac377add27fa2aa20ff642181811da9f2bbc5582ce2f582481"},{"path":"phase3-peer-sample.projection-rules.json","role":"projection-rules","sha256":"959f63a26d41d4b92b3378da459eca55b420ffca4bffad7fd7c5be24d69dee38"},{"path":"phase3-peer-sample.legibility-profile.json","role":"legibility-profile","sha256":"a1366c09ac1189c37bc45d07c23730904889b1c377e073b71fbba67d4c7fab6d"},{"path":"phase3-peer-sample.event-slices.json","role":"event-slices","sha256":"1284b0415609343161ce3df5f529706f3d25bfdd4b1f98920c76fc89249976f3"},{"path":"phase3-peer-sample.phase-slices.json","role":"phase-slices","sha256":"927a67f2433061585863dcee683d1655f30d1ba1e1eb6887cd05ab4778e4ad7f"},{"path":"phase3-peer-sample.phase-policy.json","role":"phase-policy","sha256":"475f13bbbbb29073b46b1afda7a5ad05721ae6898ab69d0503467432d82d0c6a"},{"path":"phase3-peer-sample.optical-channels.json","role":"optical-channels","sha256":"f9cfe2b0ffb292c1be040fb5be91ad68007045b77c2c68c2e881052235705fa7"}],"phaseReservations":["oan.hopng_perspectival_engram","oan.hopng_participatory_engram","oan.hopng_peral_universe_set","oan.hopng_modal_transform","oan.hopng_formation_contract","oan.identity_review_delta","oan.cert_acceptance_record","oan.module_self_base_set","oan.commitment_projection","oan.role_glyphic_act","oan.oe_chain_boundary","oan.hopng_role_header","oan.hopng_role_endcap"],"projectionFile":"phase3-peer-sample.png","schema":"oan.hopng_manifest","schemaVersion":"0.1.0","sidecars":[{"path":"phase3-peer-sample.layer-map.json","required":true,"role":"layer-map","schema":"oan.hopng_layer_map","schemaVersion":"0.1.0"},{"path":"phase3-peer-sample.trust-envelope.json","required":true,"role":"trust-envelope","schema":"oan.hopng_trust_envelope","schemaVersion":"0.1.0"},{"path":"phase3-peer-sample.transform-history.json","required":true,"role":"transform-history","schema":"oan.hopng_transform_history","schemaVersion":"0.1.0"},{"path":"phase3-peer-sample.depth-field.json","required":true,"role":"depth-field","schema":"oan.hopng_depth_field","schemaVersion":"0.1.0"},{"path":"phase3-peer-sample.hash.json","required":true,"role":"hash","schema":"oan.hopng_hash_set","schemaVersion":"0.1.0"},{"path":"phase3-peer-sample.signature.json","required":true,"role":"signature","schema":"oan.hopng_signature","schemaVersion":"0.1.0"},{"path":"phase3-peer-sample.universe-layer.json","required":true,"role":"universe-layer","schema":"oan.hopng_universe_layer","schemaVersion":"0.1.0"},{"path":"phase3-peer-sample.gluing-manifest.json","required":true,"role":"gluing-manifest","schema":"oan.hopng_gluing_manifest","schemaVersion":"0.1.0"},{"path":"phase3-peer-sample.projection-rules.json","required":true,"role":"projection-rules","schema":"oan.hopng_projection_rules","schemaVersion":"0.1.0"},{"path":"phase3-peer-sample.legibility-profile.json","required":true,"role":"legibility-profile","schema":"oan.hopng_legibility_profile","schemaVersion":"0.1.0"},{"path":"phase3-peer-sample.event-slices.json","required":true,"role":"event-slices","schema":"oan.hopng_event_slice","schemaVersion":"0.1.0"},{"path":"phase3-peer-sample.phase-slices.json","required":true,"role":"phase-slices","schema":"oan.hopng_phase_slice","schemaVersion":"0.1.0"},{"path":"phase3-peer-sample.phase-policy.json","required":true,"role":"phase-policy","schema":"oan.hopng_phase_policy","schemaVersion":"0.1.0"},{"path":"phase3-peer-sample.optical-channels.json","required":true,"role":"optical-channels","schema":"oan.hopng_optical_channels","schemaVersion":"0.1.0"}],"visibilityPolicy":{"approvedMetadataFields":["artifactId","displayName","createdUtc","projectionFile"],"crypticPointersAllowed":true,"crypticReferences":[],"machineReadableLayersAllowed":true,"primeSafeProjection":true}}