{"artifactId":"29dc4597-875d-4c39-892d-f9f0e90abb8e","createdUtc":"2026-03-30T17:13:51.4149841\u002B00:00","displayName":"phase4-perspectival-sample","fileDigests":[{"path":"phase4-perspectival-sample.png","role":"projection","sha256":"c84bbe2f061783b3c40b8ae23b05afc2eaf0665ef80b7d4e703a2f9bffa2d0ca"},{"path":"phase4-perspectival-sample.layer-map.json","role":"layer-map","sha256":"f4cdee883edb586097ea37112b14f12fb3438b3904db34ec9ec40c6f8c8c34ed"},{"path":"phase4-perspectival-sample.trust-envelope.json","role":"trust-envelope","sha256":"65e49f5c56ee47e429c91ad0c7f0a303f20378c7a1f571019533ef7aea0da5e6"},{"path":"phase4-perspectival-sample.transform-history.json","role":"transform-history","sha256":"477d0bf031230d1b8655bd9747b2b6413383abd3f90aa189e3fb6ae826711efd"},{"path":"phase4-perspectival-sample.depth-field.json","role":"depth-field","sha256":"40ce2226021ed16167df6a0191c5d5a9c4d1169472614957fa4cb8e6368e92da"},{"path":"phase4-perspectival-sample.universe-layer.json","role":"universe-layer","sha256":"e2afef2767e6e5c1932ea2747dd7f204e21f19d75b7079a764aeb53b1861c649"},{"path":"phase4-perspectival-sample.gluing-manifest.json","role":"gluing-manifest","sha256":"4fa88528d96ae896a50e88b3d4c75e6654747ddc69f336e233decb3bdbb1575b"},{"path":"phase4-perspectival-sample.projection-rules.json","role":"projection-rules","sha256":"c44ed5920413511f776bf4139c5e4a2b9816b17a51e2a65339bfe17ea271d255"},{"path":"phase4-perspectival-sample.legibility-profile.json","role":"legibility-profile","sha256":"2bfdd39ebd9ae4b47f022b1c278f68b5197d3e6d5a48762543ece9013f5c6ef7"},{"path":"phase4-perspectival-sample.event-slices.json","role":"event-slices","sha256":"d6db90b2cb4f9ccce8520d39bf7841bad1b7fd18e30a4a15c2814e7717d26c3a"},{"path":"phase4-perspectival-sample.phase-slices.json","role":"phase-slices","sha256":"2cb0032ce722293371370a3ceec33687ec7169b7d1dd9392657f7c83e6aaca24"},{"path":"phase4-perspectival-sample.phase-policy.json","role":"phase-policy","sha256":"de0e7157d74e1c16513de82c7aac192df2bb8693105c71e7dd81bb8bb4a7805d"},{"path":"phase4-perspectival-sample.optical-channels.json","role":"optical-channels","sha256":"e66b1ce06eae6bd369d2e654b9d51603d6e9d1899466a51a6f91b0c001890942"},{"path":"phase4-perspectival-sample.perspectival-engram.json","role":"perspectival-engram","sha256":"9740e3f82e4137d6b04bf5d63543f50401482735641b6982e6d9641d97e7ff93"}],"phaseReservations":["oan.hopng_peral_universe_set","oan.hopng_modal_transform","oan.hopng_formation_contract","oan.identity_review_delta","oan.cert_acceptance_record","oan.module_self_base_set","oan.commitment_projection","oan.role_glyphic_act","oan.oe_chain_boundary","oan.hopng_role_header","oan.hopng_role_endcap"],"projectionFile":"phase4-perspectival-sample.png","schema":"oan.hopng_manifest","schemaVersion":"0.1.0","sidecars":[{"path":"phase4-perspectival-sample.layer-map.json","required":true,"role":"layer-map","schema":"oan.hopng_layer_map","schemaVersion":"0.1.0"},{"path":"phase4-perspectival-sample.trust-envelope.json","required":true,"role":"trust-envelope","schema":"oan.hopng_trust_envelope","schemaVersion":"0.1.0"},{"path":"phase4-perspectival-sample.transform-history.json","required":true,"role":"transform-history","schema":"oan.hopng_transform_history","schemaVersion":"0.1.0"},{"path":"phase4-perspectival-sample.depth-field.json","required":true,"role":"depth-field","schema":"oan.hopng_depth_field","schemaVersion":"0.1.0"},{"path":"phase4-perspectival-sample.hash.json","required":true,"role":"hash","schema":"oan.hopng_hash_set","schemaVersion":"0.1.0"},{"path":"phase4-perspectival-sample.signature.json","required":true,"role":"signature","schema":"oan.hopng_signature","schemaVersion":"0.1.0"},{"path":"phase4-perspectival-sample.universe-layer.json","required":true,"role":"universe-layer","schema":"oan.hopng_universe_layer","schemaVersion":"0.1.0"},{"path":"phase4-perspectival-sample.gluing-manifest.json","required":true,"role":"gluing-manifest","schema":"oan.hopng_gluing_manifest","schemaVersion":"0.1.0"},{"path":"phase4-perspectival-sample.projection-rules.json","required":true,"role":"projection-rules","schema":"oan.hopng_projection_rules","schemaVersion":"0.1.0"},{"path":"phase4-perspectival-sample.legibility-profile.json","required":true,"role":"legibility-profile","schema":"oan.hopng_legibility_profile","schemaVersion":"0.1.0"},{"path":"phase4-perspectival-sample.event-slices.json","required":true,"role":"event-slices","schema":"oan.hopng_event_slice","schemaVersion":"0.1.0"},{"path":"phase4-perspectival-sample.phase-slices.json","required":true,"role":"phase-slices","schema":"oan.hopng_phase_slice","schemaVersion":"0.1.0"},{"path":"phase4-perspectival-sample.phase-policy.json","required":true,"role":"phase-policy","schema":"oan.hopng_phase_policy","schemaVersion":"0.1.0"},{"path":"phase4-perspectival-sample.optical-channels.json","required":true,"role":"optical-channels","schema":"oan.hopng_optical_channels","schemaVersion":"0.1.0"},{"path":"phase4-perspectival-sample.perspectival-engram.json","required":true,"role":"perspectival-engram","schema":"oan.hopng_perspectival_engram","schemaVersion":"0.1.0"}],"visibilityPolicy":{"approvedMetadataFields":["artifactId","displayName","createdUtc","projectionFile"],"crypticPointersAllowed":true,"crypticReferences":[],"machineReadableLayersAllowed":true,"primeSafeProjection":true}}