{"artifactId":"c7f83255-d629-476f-9ce4-6228aaf71b83","createdUtc":"2026-03-30T17:13:54.8984339\u002B00:00","displayName":"phase4-deferred-perspectival","fileDigests":[{"path":"phase4-deferred-perspectival.png","role":"projection","sha256":"c84bbe2f061783b3c40b8ae23b05afc2eaf0665ef80b7d4e703a2f9bffa2d0ca"},{"path":"phase4-deferred-perspectival.layer-map.json","role":"layer-map","sha256":"9dcfc8212cb4b07dd914042072c2e62b881898ef74bcb05fcffc1ba81b1514e7"},{"path":"phase4-deferred-perspectival.trust-envelope.json","role":"trust-envelope","sha256":"1ece6ea8226b29975ad53cbf755c8d9134cac8b43dfed745a89ed8e628dc58c4"},{"path":"phase4-deferred-perspectival.transform-history.json","role":"transform-history","sha256":"0b68e35e97ff59ea95ad48b42182cfbefc91281f191c3fbecd9fe0920a58d6ff"},{"path":"phase4-deferred-perspectival.depth-field.json","role":"depth-field","sha256":"781a9bcb8c9fae53bfac750c795256ad7ac18cd85909fc90edf51ff70d41a42e"},{"path":"phase4-deferred-perspectival.universe-layer.json","role":"universe-layer","sha256":"f04e742170fe0313a1611a93abcb72978736637d490dec1f0fb630bb8d05f48c"},{"path":"phase4-deferred-perspectival.gluing-manifest.json","role":"gluing-manifest","sha256":"91296f56486152926b245781be5677921b166a5438ec806599143166e98c6da1"},{"path":"phase4-deferred-perspectival.projection-rules.json","role":"projection-rules","sha256":"029e3beed4f6325ce2160f525a20b11c918d9efebf5b17000a315bc47ca1f69f"},{"path":"phase4-deferred-perspectival.legibility-profile.json","role":"legibility-profile","sha256":"085222beca8d50e834427376f350b5febc2a9e694126a8874e5e210a349da3a9"},{"path":"phase4-deferred-perspectival.event-slices.json","role":"event-slices","sha256":"162870dcfb761d825f2dfc7a943b4362ec9ba39a77e39d42d63ccffa6f4a0aaa"},{"path":"phase4-deferred-perspectival.phase-slices.json","role":"phase-slices","sha256":"c55f16e99fd5db58ed5587b80f37c33c7a672c40439ef247bd93f695d481e1e7"},{"path":"phase4-deferred-perspectival.phase-policy.json","role":"phase-policy","sha256":"977d83a8da89d4d8c7b8a0b968a25cb055cfdc70aa1a1136a2b75f1382b80e6f"},{"path":"phase4-deferred-perspectival.optical-channels.json","role":"optical-channels","sha256":"fab96179a83e30f478a15303a5a1f3111a09e3693d8a0e647f383a10ca9fdf3f"},{"path":"phase4-deferred-perspectival.perspectival-engram.json","role":"perspectival-engram","sha256":"f354e62f0f3c780772a615fe1040a2fe1ac56ef3abd53632b9908a0f1ff4e568"}],"phaseReservations":["oan.hopng_peral_universe_set","oan.hopng_modal_transform","oan.hopng_formation_contract","oan.identity_review_delta","oan.cert_acceptance_record","oan.module_self_base_set","oan.commitment_projection","oan.role_glyphic_act","oan.oe_chain_boundary","oan.hopng_role_header","oan.hopng_role_endcap"],"projectionFile":"phase4-deferred-perspectival.png","schema":"oan.hopng_manifest","schemaVersion":"0.1.0","sidecars":[{"path":"phase4-deferred-perspectival.layer-map.json","required":true,"role":"layer-map","schema":"oan.hopng_layer_map","schemaVersion":"0.1.0"},{"path":"phase4-deferred-perspectival.trust-envelope.json","required":true,"role":"trust-envelope","schema":"oan.hopng_trust_envelope","schemaVersion":"0.1.0"},{"path":"phase4-deferred-perspectival.transform-history.json","required":true,"role":"transform-history","schema":"oan.hopng_transform_history","schemaVersion":"0.1.0"},{"path":"phase4-deferred-perspectival.depth-field.json","required":true,"role":"depth-field","schema":"oan.hopng_depth_field","schemaVersion":"0.1.0"},{"path":"phase4-deferred-perspectival.hash.json","required":true,"role":"hash","schema":"oan.hopng_hash_set","schemaVersion":"0.1.0"},{"path":"phase4-deferred-perspectival.signature.json","required":true,"role":"signature","schema":"oan.hopng_signature","schemaVersion":"0.1.0"},{"path":"phase4-deferred-perspectival.universe-layer.json","required":true,"role":"universe-layer","schema":"oan.hopng_universe_layer","schemaVersion":"0.1.0"},{"path":"phase4-deferred-perspectival.gluing-manifest.json","required":true,"role":"gluing-manifest","schema":"oan.hopng_gluing_manifest","schemaVersion":"0.1.0"},{"path":"phase4-deferred-perspectival.projection-rules.json","required":true,"role":"projection-rules","schema":"oan.hopng_projection_rules","schemaVersion":"0.1.0"},{"path":"phase4-deferred-perspectival.legibility-profile.json","required":true,"role":"legibility-profile","schema":"oan.hopng_legibility_profile","schemaVersion":"0.1.0"},{"path":"phase4-deferred-perspectival.event-slices.json","required":true,"role":"event-slices","schema":"oan.hopng_event_slice","schemaVersion":"0.1.0"},{"path":"phase4-deferred-perspectival.phase-slices.json","required":true,"role":"phase-slices","schema":"oan.hopng_phase_slice","schemaVersion":"0.1.0"},{"path":"phase4-deferred-perspectival.phase-policy.json","required":true,"role":"phase-policy","schema":"oan.hopng_phase_policy","schemaVersion":"0.1.0"},{"path":"phase4-deferred-perspectival.optical-channels.json","required":true,"role":"optical-channels","schema":"oan.hopng_optical_channels","schemaVersion":"0.1.0"},{"path":"phase4-deferred-perspectival.perspectival-engram.json","required":true,"role":"perspectival-engram","schema":"oan.hopng_perspectival_engram","schemaVersion":"0.1.0"}],"visibilityPolicy":{"approvedMetadataFields":["artifactId","displayName","createdUtc","projectionFile"],"crypticPointersAllowed":true,"crypticReferences":[],"machineReadableLayersAllowed":true,"primeSafeProjection":true}}