{"artifactId":"742c3cdd-d04d-49e8-a7f9-d783d178faac","createdUtc":"2026-03-30T17:13:58.317223\u002B00:00","displayName":"phase4-participatory-peer","fileDigests":[{"path":"phase4-participatory-peer.png","role":"projection","sha256":"c84bbe2f061783b3c40b8ae23b05afc2eaf0665ef80b7d4e703a2f9bffa2d0ca"},{"path":"phase4-participatory-peer.layer-map.json","role":"layer-map","sha256":"62509684577546b6da5bdb3174c50c48f96631fc1e6b449d3e5792b1f40911d0"},{"path":"phase4-participatory-peer.trust-envelope.json","role":"trust-envelope","sha256":"0e743c229ecd3067445e812e57f868998d62b61f753b15b9f369fa824d669ada"},{"path":"phase4-participatory-peer.transform-history.json","role":"transform-history","sha256":"066e52640c8ced9b325fcb2358634e05463c10b8af2b794e7474338542af4085"},{"path":"phase4-participatory-peer.depth-field.json","role":"depth-field","sha256":"4d10ba2379cbb8040d77172f3d0c3ca97ac183aff5c8656fa6a442fde7f009af"},{"path":"phase4-participatory-peer.universe-layer.json","role":"universe-layer","sha256":"f0fc65f84de5ec92ee2acde4cb4226ffd0f00212fdc7f2f376f859ce18f47b6d"},{"path":"phase4-participatory-peer.gluing-manifest.json","role":"gluing-manifest","sha256":"1e2c46f9bda11e2b1f96d7913e2abf2da723c62fe9489faea024f8a40680415c"},{"path":"phase4-participatory-peer.projection-rules.json","role":"projection-rules","sha256":"c46dc9ef91233bfb312a4f8f72397be72483f52a00523309b5e0783803c0323e"},{"path":"phase4-participatory-peer.legibility-profile.json","role":"legibility-profile","sha256":"f8b4745df84b83bb67ae6204a9d68e6dd48c48d3b46704e6ecbd4e1aab4bc2a8"},{"path":"phase4-participatory-peer.event-slices.json","role":"event-slices","sha256":"4a7826ca6135c3c6dc630b6c5c79ac1514fe8eedf2cf424f25947223ce93fc86"},{"path":"phase4-participatory-peer.phase-slices.json","role":"phase-slices","sha256":"9e2a139b25040d50b05b5cabaeb872d4ef2042678921ee299d528a186ee23b2a"},{"path":"phase4-participatory-peer.phase-policy.json","role":"phase-policy","sha256":"e50f25aff6af954a4ebe41452b1327e0812193d336f4e37b70f5d7f46dc6f22d"},{"path":"phase4-participatory-peer.optical-channels.json","role":"optical-channels","sha256":"ac3fd69140afa0a66094dc800b032b88ce7a57defc3e44dfd81ae50e762f7178"},{"path":"phase4-participatory-peer.participatory-engram.json","role":"participatory-engram","sha256":"b9eecda236d7cdd74ba023ecbe7e0efaffd091672375a7dec46822ad43f00aed"}],"phaseReservations":["oan.hopng_peral_universe_set","oan.hopng_modal_transform","oan.hopng_formation_contract","oan.identity_review_delta","oan.cert_acceptance_record","oan.module_self_base_set","oan.commitment_projection","oan.role_glyphic_act","oan.oe_chain_boundary","oan.hopng_role_header","oan.hopng_role_endcap"],"projectionFile":"phase4-participatory-peer.png","schema":"oan.hopng_manifest","schemaVersion":"0.1.0","sidecars":[{"path":"phase4-participatory-peer.layer-map.json","required":true,"role":"layer-map","schema":"oan.hopng_layer_map","schemaVersion":"0.1.0"},{"path":"phase4-participatory-peer.trust-envelope.json","required":true,"role":"trust-envelope","schema":"oan.hopng_trust_envelope","schemaVersion":"0.1.0"},{"path":"phase4-participatory-peer.transform-history.json","required":true,"role":"transform-history","schema":"oan.hopng_transform_history","schemaVersion":"0.1.0"},{"path":"phase4-participatory-peer.depth-field.json","required":true,"role":"depth-field","schema":"oan.hopng_depth_field","schemaVersion":"0.1.0"},{"path":"phase4-participatory-peer.hash.json","required":true,"role":"hash","schema":"oan.hopng_hash_set","schemaVersion":"0.1.0"},{"path":"phase4-participatory-peer.signature.json","required":true,"role":"signature","schema":"oan.hopng_signature","schemaVersion":"0.1.0"},{"path":"phase4-participatory-peer.universe-layer.json","required":true,"role":"universe-layer","schema":"oan.hopng_universe_layer","schemaVersion":"0.1.0"},{"path":"phase4-participatory-peer.gluing-manifest.json","required":true,"role":"gluing-manifest","schema":"oan.hopng_gluing_manifest","schemaVersion":"0.1.0"},{"path":"phase4-participatory-peer.projection-rules.json","required":true,"role":"projection-rules","schema":"oan.hopng_projection_rules","schemaVersion":"0.1.0"},{"path":"phase4-participatory-peer.legibility-profile.json","required":true,"role":"legibility-profile","schema":"oan.hopng_legibility_profile","schemaVersion":"0.1.0"},{"path":"phase4-participatory-peer.event-slices.json","required":true,"role":"event-slices","schema":"oan.hopng_event_slice","schemaVersion":"0.1.0"},{"path":"phase4-participatory-peer.phase-slices.json","required":true,"role":"phase-slices","schema":"oan.hopng_phase_slice","schemaVersion":"0.1.0"},{"path":"phase4-participatory-peer.phase-policy.json","required":true,"role":"phase-policy","schema":"oan.hopng_phase_policy","schemaVersion":"0.1.0"},{"path":"phase4-participatory-peer.optical-channels.json","required":true,"role":"optical-channels","schema":"oan.hopng_optical_channels","schemaVersion":"0.1.0"},{"path":"phase4-participatory-peer.participatory-engram.json","required":true,"role":"participatory-engram","schema":"oan.hopng_participatory_engram","schemaVersion":"0.1.0"}],"visibilityPolicy":{"approvedMetadataFields":["artifactId","displayName","createdUtc","projectionFile"],"crypticPointersAllowed":true,"crypticReferences":[],"machineReadableLayersAllowed":true,"primeSafeProjection":true}}