{"artifactId":"a9038cc7-8dc5-497c-ad6f-99d477562f4d","createdUtc":"2026-03-30T17:13:53.7277506\u002B00:00","displayName":"phase4-restricted-perspectival","fileDigests":[{"path":"phase4-restricted-perspectival.png","role":"projection","sha256":"c84bbe2f061783b3c40b8ae23b05afc2eaf0665ef80b7d4e703a2f9bffa2d0ca"},{"path":"phase4-restricted-perspectival.layer-map.json","role":"layer-map","sha256":"cd908d7b91ab53dd6786541ac22434944ff7e8874fdb18dbef19a9d05a465cbe"},{"path":"phase4-restricted-perspectival.trust-envelope.json","role":"trust-envelope","sha256":"2161ce20e08904051ae9df4aa4260f8d51653f19113b5214c516423279aaf319"},{"path":"phase4-restricted-perspectival.transform-history.json","role":"transform-history","sha256":"397f1c31982006ba128cb44de1fe89dfabe8e994a67c85a7c30dbdbd8e0ae641"},{"path":"phase4-restricted-perspectival.depth-field.json","role":"depth-field","sha256":"b4f3e695125cd92840edbd4da414c010c1eeed09f4200ab653c0523cd80a5b54"},{"path":"phase4-restricted-perspectival.universe-layer.json","role":"universe-layer","sha256":"31ffce91502eacae94a1f47a18026694b9e97f0e3ef2f4750cace3b8bc3b83a8"},{"path":"phase4-restricted-perspectival.gluing-manifest.json","role":"gluing-manifest","sha256":"024575a159f761f0e06280c99554e5c45e6f17552f7697ac295fe8c33b00805f"},{"path":"phase4-restricted-perspectival.projection-rules.json","role":"projection-rules","sha256":"09415b540bc333a0ec965fabbddeafc088c9b4896d68607ef197d20e992ac52e"},{"path":"phase4-restricted-perspectival.legibility-profile.json","role":"legibility-profile","sha256":"e681388795aa5ba4443d6fa25ae10f86aa3b2f2391ab3725529baaffea0565f2"},{"path":"phase4-restricted-perspectival.event-slices.json","role":"event-slices","sha256":"c510bea070287b64ec1c5d017db3bfd714021000d20af619f36a634973536fde"},{"path":"phase4-restricted-perspectival.phase-slices.json","role":"phase-slices","sha256":"55cdf8d671100e59e1f4a69a886b0edf60e10a53c37b5418a7fc800904e07850"},{"path":"phase4-restricted-perspectival.phase-policy.json","role":"phase-policy","sha256":"54bdc2c901d661458106fd743bf53898b00a03cdbf9d9e63c1e0f4f346072b8b"},{"path":"phase4-restricted-perspectival.optical-channels.json","role":"optical-channels","sha256":"96d560393dca23cf86d52e3aa52c09ca11d68cc3699cca73a2e7377eba42ebd4"},{"path":"phase4-restricted-perspectival.perspectival-engram.json","role":"perspectival-engram","sha256":"90b5e5c97d044746ec2e918bb2ef3fd1ff92faec7179471869b68e8b8d3fb78f"}],"phaseReservations":["oan.hopng_peral_universe_set","oan.hopng_modal_transform","oan.hopng_formation_contract","oan.identity_review_delta","oan.cert_acceptance_record","oan.module_self_base_set","oan.commitment_projection","oan.role_glyphic_act","oan.oe_chain_boundary","oan.hopng_role_header","oan.hopng_role_endcap"],"projectionFile":"phase4-restricted-perspectival.png","schema":"oan.hopng_manifest","schemaVersion":"0.1.0","sidecars":[{"path":"phase4-restricted-perspectival.layer-map.json","required":true,"role":"layer-map","schema":"oan.hopng_layer_map","schemaVersion":"0.1.0"},{"path":"phase4-restricted-perspectival.trust-envelope.json","required":true,"role":"trust-envelope","schema":"oan.hopng_trust_envelope","schemaVersion":"0.1.0"},{"path":"phase4-restricted-perspectival.transform-history.json","required":true,"role":"transform-history","schema":"oan.hopng_transform_history","schemaVersion":"0.1.0"},{"path":"phase4-restricted-perspectival.depth-field.json","required":true,"role":"depth-field","schema":"oan.hopng_depth_field","schemaVersion":"0.1.0"},{"path":"phase4-restricted-perspectival.hash.json","required":true,"role":"hash","schema":"oan.hopng_hash_set","schemaVersion":"0.1.0"},{"path":"phase4-restricted-perspectival.signature.json","required":true,"role":"signature","schema":"oan.hopng_signature","schemaVersion":"0.1.0"},{"path":"phase4-restricted-perspectival.universe-layer.json","required":true,"role":"universe-layer","schema":"oan.hopng_universe_layer","schemaVersion":"0.1.0"},{"path":"phase4-restricted-perspectival.gluing-manifest.json","required":true,"role":"gluing-manifest","schema":"oan.hopng_gluing_manifest","schemaVersion":"0.1.0"},{"path":"phase4-restricted-perspectival.projection-rules.json","required":true,"role":"projection-rules","schema":"oan.hopng_projection_rules","schemaVersion":"0.1.0"},{"path":"phase4-restricted-perspectival.legibility-profile.json","required":true,"role":"legibility-profile","schema":"oan.hopng_legibility_profile","schemaVersion":"0.1.0"},{"path":"phase4-restricted-perspectival.event-slices.json","required":true,"role":"event-slices","schema":"oan.hopng_event_slice","schemaVersion":"0.1.0"},{"path":"phase4-restricted-perspectival.phase-slices.json","required":true,"role":"phase-slices","schema":"oan.hopng_phase_slice","schemaVersion":"0.1.0"},{"path":"phase4-restricted-perspectival.phase-policy.json","required":true,"role":"phase-policy","schema":"oan.hopng_phase_policy","schemaVersion":"0.1.0"},{"path":"phase4-restricted-perspectival.optical-channels.json","required":true,"role":"optical-channels","schema":"oan.hopng_optical_channels","schemaVersion":"0.1.0"},{"path":"phase4-restricted-perspectival.perspectival-engram.json","required":true,"role":"perspectival-engram","schema":"oan.hopng_perspectival_engram","schemaVersion":"0.1.0"}],"visibilityPolicy":{"approvedMetadataFields":["artifactId","displayName","createdUtc","projectionFile"],"crypticPointersAllowed":true,"crypticReferences":[],"machineReadableLayersAllowed":true,"primeSafeProjection":true}}