{"artifactId":"a543ba2e-9cc4-40aa-a2be-f6215f33c714","createdUtc":"2026-03-30T07:33:43.2194102\u002B00:00","displayName":"phase3-incompatible-basis","fileDigests":[{"path":"phase3-incompatible-basis.png","role":"projection","sha256":"c84bbe2f061783b3c40b8ae23b05afc2eaf0665ef80b7d4e703a2f9bffa2d0ca"},{"path":"phase3-incompatible-basis.layer-map.json","role":"layer-map","sha256":"d8ef62d22279c8a18e20192194d371148925cab20dab6c941cef857f096548f7"},{"path":"phase3-incompatible-basis.trust-envelope.json","role":"trust-envelope","sha256":"71276d7c74773a6bf815b64e16d9f0dca4394d9ab33aab18cd01401fa81282eb"},{"path":"phase3-incompatible-basis.transform-history.json","role":"transform-history","sha256":"f3451f10d7d01e395199772e4d99e47b2a6e8cbca715339ecb4895ea57b980ac"},{"path":"phase3-incompatible-basis.depth-field.json","role":"depth-field","sha256":"d4ecb7279239e04dffaee0f04e1cfdabd0e27b7a0ff264141766fe9300c80230"},{"path":"phase3-incompatible-basis.universe-layer.json","role":"universe-layer","sha256":"451a8bae5ed451207bd5c86df855726e35e84cbcae4c4b2897db92e088b7f117"},{"path":"phase3-incompatible-basis.gluing-manifest.json","role":"gluing-manifest","sha256":"b92608e1afcbdc9a685909c16ae4d0c7662bb57a7776137ba88496f2f35009f5"},{"path":"phase3-incompatible-basis.projection-rules.json","role":"projection-rules","sha256":"b0e0b31afc3265708bfd1b4e69899d0c1a2f993d61beaeb4bfaa7c4f47e5079e"},{"path":"phase3-incompatible-basis.legibility-profile.json","role":"legibility-profile","sha256":"52d533e623e23269f949eec73845309b2882c9c25b4a46f2a8e69ecef485d6e1"},{"path":"phase3-incompatible-basis.event-slices.json","role":"event-slices","sha256":"66af3ed6e44e7ba04191995eaf74b330a193f28fd2ff872bbb60be94ffed3d6a"},{"path":"phase3-incompatible-basis.phase-slices.json","role":"phase-slices","sha256":"77eac6f257399c4c1820360bb8c72d1e639b8bc3eb0067f3133e825e76964b2d"},{"path":"phase3-incompatible-basis.phase-policy.json","role":"phase-policy","sha256":"16b340c77ff07912cec74c1490dadcc3b6777c5e655f2b271dec5ee07145e944"},{"path":"phase3-incompatible-basis.optical-channels.json","role":"optical-channels","sha256":"18a7c72c09e1288fd45a1ae240a36bb09a10c556d331ba5ff6d7451e273f4ba2"}],"phaseReservations":["oan.hopng_perspectival_engram","oan.hopng_participatory_engram","oan.hopng_peral_universe_set","oan.hopng_modal_transform","oan.hopng_formation_contract","oan.identity_review_delta","oan.cert_acceptance_record","oan.module_self_base_set","oan.commitment_projection","oan.role_glyphic_act","oan.oe_chain_boundary","oan.hopng_role_header","oan.hopng_role_endcap"],"projectionFile":"phase3-incompatible-basis.png","schema":"oan.hopng_manifest","schemaVersion":"0.1.0","sidecars":[{"path":"phase3-incompatible-basis.layer-map.json","required":true,"role":"layer-map","schema":"oan.hopng_layer_map","schemaVersion":"0.1.0"},{"path":"phase3-incompatible-basis.trust-envelope.json","required":true,"role":"trust-envelope","schema":"oan.hopng_trust_envelope","schemaVersion":"0.1.0"},{"path":"phase3-incompatible-basis.transform-history.json","required":true,"role":"transform-history","schema":"oan.hopng_transform_history","schemaVersion":"0.1.0"},{"path":"phase3-incompatible-basis.depth-field.json","required":true,"role":"depth-field","schema":"oan.hopng_depth_field","schemaVersion":"0.1.0"},{"path":"phase3-incompatible-basis.hash.json","required":true,"role":"hash","schema":"oan.hopng_hash_set","schemaVersion":"0.1.0"},{"path":"phase3-incompatible-basis.signature.json","required":true,"role":"signature","schema":"oan.hopng_signature","schemaVersion":"0.1.0"},{"path":"phase3-incompatible-basis.universe-layer.json","required":true,"role":"universe-layer","schema":"oan.hopng_universe_layer","schemaVersion":"0.1.0"},{"path":"phase3-incompatible-basis.gluing-manifest.json","required":true,"role":"gluing-manifest","schema":"oan.hopng_gluing_manifest","schemaVersion":"0.1.0"},{"path":"phase3-incompatible-basis.projection-rules.json","required":true,"role":"projection-rules","schema":"oan.hopng_projection_rules","schemaVersion":"0.1.0"},{"path":"phase3-incompatible-basis.legibility-profile.json","required":true,"role":"legibility-profile","schema":"oan.hopng_legibility_profile","schemaVersion":"0.1.0"},{"path":"phase3-incompatible-basis.event-slices.json","required":true,"role":"event-slices","schema":"oan.hopng_event_slice","schemaVersion":"0.1.0"},{"path":"phase3-incompatible-basis.phase-slices.json","required":true,"role":"phase-slices","schema":"oan.hopng_phase_slice","schemaVersion":"0.1.0"},{"path":"phase3-incompatible-basis.phase-policy.json","required":true,"role":"phase-policy","schema":"oan.hopng_phase_policy","schemaVersion":"0.1.0"},{"path":"phase3-incompatible-basis.optical-channels.json","required":true,"role":"optical-channels","schema":"oan.hopng_optical_channels","schemaVersion":"0.1.0"}],"visibilityPolicy":{"approvedMetadataFields":["artifactId","displayName","createdUtc","projectionFile"],"crypticPointersAllowed":true,"crypticReferences":[],"machineReadableLayersAllowed":true,"primeSafeProjection":true}}