{"artifactId":"71ee9640-daa7-4abd-8980-83bc53607f14","createdUtc":"2026-03-30T17:13:52.5609169\u002B00:00","displayName":"phase4-perspectival-peer","fileDigests":[{"path":"phase4-perspectival-peer.png","role":"projection","sha256":"c84bbe2f061783b3c40b8ae23b05afc2eaf0665ef80b7d4e703a2f9bffa2d0ca"},{"path":"phase4-perspectival-peer.layer-map.json","role":"layer-map","sha256":"54139927882e451a0340936621c8462313aa37160a8a5cd01a433a0cd383e3d1"},{"path":"phase4-perspectival-peer.trust-envelope.json","role":"trust-envelope","sha256":"743de4ae50da60ed66c8463c382cf7a6a6525abeba1cc4cbcdee9c49a318d5ab"},{"path":"phase4-perspectival-peer.transform-history.json","role":"transform-history","sha256":"c64860fc1081d0ceb94a34523145717d0d5da64ea82a2d6a786fe9a08c40622f"},{"path":"phase4-perspectival-peer.depth-field.json","role":"depth-field","sha256":"90a3a8a0b37e6229681ad4077866a03de53220a4840fa13d05290813c64b62ab"},{"path":"phase4-perspectival-peer.universe-layer.json","role":"universe-layer","sha256":"ff29f8589152e838fb25bbe6c8fefb78e299d49dd8f7cc657557be068da62123"},{"path":"phase4-perspectival-peer.gluing-manifest.json","role":"gluing-manifest","sha256":"a0514fb89a9618612ff1b78b0a11c3568515c1c898a4e902156df7cc4fa8b38b"},{"path":"phase4-perspectival-peer.projection-rules.json","role":"projection-rules","sha256":"f619ab367d1c0804b70bd2847d84b4ffcc143ea47a8feb2ba03808c9f9449bef"},{"path":"phase4-perspectival-peer.legibility-profile.json","role":"legibility-profile","sha256":"72276d891cf2eb64360dab045e99cd9c474eb7d3f98fa5bc4cc261ab66e090b2"},{"path":"phase4-perspectival-peer.event-slices.json","role":"event-slices","sha256":"8e12c60070d53aeb0a0543f03a915de83220f84f65c79b2bf680dbecc8527588"},{"path":"phase4-perspectival-peer.phase-slices.json","role":"phase-slices","sha256":"3b32ff247c4aa9ba2a887f60ab1ce6923db0de527773758e8d5dde203a384675"},{"path":"phase4-perspectival-peer.phase-policy.json","role":"phase-policy","sha256":"ecc4f7ab27298fde3410060c1f85e4d8fd250ee9f3a7dc6320695eb54e7989c7"},{"path":"phase4-perspectival-peer.optical-channels.json","role":"optical-channels","sha256":"2b84046f32ec5dd550055775a70490f8a254d6a651f4673644aad878767922b9"},{"path":"phase4-perspectival-peer.perspectival-engram.json","role":"perspectival-engram","sha256":"df0c7f41a9ce77b823c14430f5f30ca946da39d39be3135d6432d4532f6775f0"}],"phaseReservations":["oan.hopng_peral_universe_set","oan.hopng_modal_transform","oan.hopng_formation_contract","oan.identity_review_delta","oan.cert_acceptance_record","oan.module_self_base_set","oan.commitment_projection","oan.role_glyphic_act","oan.oe_chain_boundary","oan.hopng_role_header","oan.hopng_role_endcap"],"projectionFile":"phase4-perspectival-peer.png","schema":"oan.hopng_manifest","schemaVersion":"0.1.0","sidecars":[{"path":"phase4-perspectival-peer.layer-map.json","required":true,"role":"layer-map","schema":"oan.hopng_layer_map","schemaVersion":"0.1.0"},{"path":"phase4-perspectival-peer.trust-envelope.json","required":true,"role":"trust-envelope","schema":"oan.hopng_trust_envelope","schemaVersion":"0.1.0"},{"path":"phase4-perspectival-peer.transform-history.json","required":true,"role":"transform-history","schema":"oan.hopng_transform_history","schemaVersion":"0.1.0"},{"path":"phase4-perspectival-peer.depth-field.json","required":true,"role":"depth-field","schema":"oan.hopng_depth_field","schemaVersion":"0.1.0"},{"path":"phase4-perspectival-peer.hash.json","required":true,"role":"hash","schema":"oan.hopng_hash_set","schemaVersion":"0.1.0"},{"path":"phase4-perspectival-peer.signature.json","required":true,"role":"signature","schema":"oan.hopng_signature","schemaVersion":"0.1.0"},{"path":"phase4-perspectival-peer.universe-layer.json","required":true,"role":"universe-layer","schema":"oan.hopng_universe_layer","schemaVersion":"0.1.0"},{"path":"phase4-perspectival-peer.gluing-manifest.json","required":true,"role":"gluing-manifest","schema":"oan.hopng_gluing_manifest","schemaVersion":"0.1.0"},{"path":"phase4-perspectival-peer.projection-rules.json","required":true,"role":"projection-rules","schema":"oan.hopng_projection_rules","schemaVersion":"0.1.0"},{"path":"phase4-perspectival-peer.legibility-profile.json","required":true,"role":"legibility-profile","schema":"oan.hopng_legibility_profile","schemaVersion":"0.1.0"},{"path":"phase4-perspectival-peer.event-slices.json","required":true,"role":"event-slices","schema":"oan.hopng_event_slice","schemaVersion":"0.1.0"},{"path":"phase4-perspectival-peer.phase-slices.json","required":true,"role":"phase-slices","schema":"oan.hopng_phase_slice","schemaVersion":"0.1.0"},{"path":"phase4-perspectival-peer.phase-policy.json","required":true,"role":"phase-policy","schema":"oan.hopng_phase_policy","schemaVersion":"0.1.0"},{"path":"phase4-perspectival-peer.optical-channels.json","required":true,"role":"optical-channels","schema":"oan.hopng_optical_channels","schemaVersion":"0.1.0"},{"path":"phase4-perspectival-peer.perspectival-engram.json","required":true,"role":"perspectival-engram","schema":"oan.hopng_perspectival_engram","schemaVersion":"0.1.0"}],"visibilityPolicy":{"approvedMetadataFields":["artifactId","displayName","createdUtc","projectionFile"],"crypticPointersAllowed":true,"crypticReferences":[],"machineReadableLayersAllowed":true,"primeSafeProjection":true}}