{"artifactId":"a407d8a5-18eb-4142-947a-4eb110f86bd1","createdUtc":"2026-03-05T23:13:38.8875642\u002B00:00","displayName":"Phase 1 Sample","fileDigests":[{"path":"phase1-sample.png","role":"projection","sha256":"c84bbe2f061783b3c40b8ae23b05afc2eaf0665ef80b7d4e703a2f9bffa2d0ca"},{"path":"phase1-sample.layer-map.json","role":"layer-map","sha256":"74ac3b6847d4a5c7c81722b8e936f04e171861d2e4305917de856e16e9995dfe"},{"path":"phase1-sample.trust-envelope.json","role":"trust-envelope","sha256":"662634a3f52a8ce6ecce9d0402adbbb94160339a5d3bc1844209d3e1e0825d98"},{"path":"phase1-sample.transform-history.json","role":"transform-history","sha256":"9f4babf8c8f3829f2cf5455da85843df094eb56b242d7a2bcbdb2213c72754a6"},{"path":"phase1-sample.depth-field.json","role":"depth-field","sha256":"08696f559993dbb3ce4f23c24d190e7d9fa08c5ef0dc906cc510bfd2ef2c507e"}],"phaseReservations":["oan.hopng_universe_layer","oan.hopng_gluing_manifest","oan.hopng_projection_rules","oan.hopng_legibility_profile","oan.hopng_event_slice","oan.hopng_phase_slice","oan.hopng_phase_policy","oan.hopng_optical_channels","oan.hopng_perspectival_engram","oan.hopng_participatory_engram","oan.hopng_peral_universe_set","oan.hopng_modal_transform","oan.hopng_formation_contract","oan.identity_review_delta","oan.cert_acceptance_record","oan.module_self_base_set","oan.commitment_projection","oan.role_glyphic_act","oan.oe_chain_boundary","oan.hopng_role_header","oan.hopng_role_endcap"],"projectionFile":"phase1-sample.png","schema":"oan.hopng_manifest","schemaVersion":"0.1.0","sidecars":[{"path":"phase1-sample.layer-map.json","required":true,"role":"layer-map","schema":"oan.hopng_layer_map","schemaVersion":"0.1.0"},{"path":"phase1-sample.trust-envelope.json","required":true,"role":"trust-envelope","schema":"oan.hopng_trust_envelope","schemaVersion":"0.1.0"},{"path":"phase1-sample.transform-history.json","required":true,"role":"transform-history","schema":"oan.hopng_transform_history","schemaVersion":"0.1.0"},{"path":"phase1-sample.depth-field.json","required":true,"role":"depth-field","schema":"oan.hopng_depth_field","schemaVersion":"0.1.0"},{"path":"phase1-sample.hash.json","required":true,"role":"hash","schema":"oan.hopng_hash_set","schemaVersion":"0.1.0"},{"path":"phase1-sample.signature.json","required":true,"role":"signature","schema":"oan.hopng_signature","schemaVersion":"0.1.0"}],"visibilityPolicy":{"approvedMetadataFields":["artifactId","displayName","createdUtc","projectionFile"],"crypticPointersAllowed":true,"crypticReferences":[],"machineReadableLayersAllowed":true,"primeSafeProjection":true}}