{"artifactId":"a79dc016-dfdf-419b-8ddb-5aa7bf1f2933","createdUtc":"2026-03-07T00:48:04.6541345\u002B00:00","displayName":"phase2-sample","fileDigests":[{"path":"phase2-sample.png","role":"projection","sha256":"c84bbe2f061783b3c40b8ae23b05afc2eaf0665ef80b7d4e703a2f9bffa2d0ca"},{"path":"phase2-sample.layer-map.json","role":"layer-map","sha256":"faf69a817f3071bee23ab628bbdd3fd16570e32c7915526fd0c8c13cb68dc53a"},{"path":"phase2-sample.trust-envelope.json","role":"trust-envelope","sha256":"72d473445cd3856a9639423655f92102a2059cc1409a5a27d9781c0c4779add1"},{"path":"phase2-sample.transform-history.json","role":"transform-history","sha256":"3b7999ddda7be50cdb452c568ab71af6f287746d304772624b819e3278f62705"},{"path":"phase2-sample.depth-field.json","role":"depth-field","sha256":"ec5810d606e9ca9ffc2ea4889ab5e6a69d07a5d869cc361c50b4a06d4d58e175"},{"path":"phase2-sample.universe-layer.json","role":"universe-layer","sha256":"5737d2b2f3689c1e7e596cd2ce4dd9aa9a7eb54a2967164aa77c58d5a18633c6"},{"path":"phase2-sample.gluing-manifest.json","role":"gluing-manifest","sha256":"6bb5d1349a1478621228b31b6da591634238a6a1e91c10d3244f722723712d78"},{"path":"phase2-sample.projection-rules.json","role":"projection-rules","sha256":"3e77b1bda42d54aa3586fc59f521371ad78f110c99a25be5a9fb3c21960e3da0"},{"path":"phase2-sample.legibility-profile.json","role":"legibility-profile","sha256":"2f21acfd091fd48984d7fbd89f3b6f716d8f4cbe26ff21ff2e2407606c032438"}],"phaseReservations":["oan.hopng_event_slice","oan.hopng_phase_slice","oan.hopng_phase_policy","oan.hopng_optical_channels","oan.hopng_perspectival_engram","oan.hopng_participatory_engram","oan.hopng_peral_universe_set","oan.hopng_modal_transform","oan.hopng_formation_contract","oan.identity_review_delta","oan.cert_acceptance_record","oan.module_self_base_set","oan.commitment_projection","oan.role_glyphic_act","oan.oe_chain_boundary","oan.hopng_role_header","oan.hopng_role_endcap"],"projectionFile":"phase2-sample.png","schema":"oan.hopng_manifest","schemaVersion":"0.1.0","sidecars":[{"path":"phase2-sample.layer-map.json","required":true,"role":"layer-map","schema":"oan.hopng_layer_map","schemaVersion":"0.1.0"},{"path":"phase2-sample.trust-envelope.json","required":true,"role":"trust-envelope","schema":"oan.hopng_trust_envelope","schemaVersion":"0.1.0"},{"path":"phase2-sample.transform-history.json","required":true,"role":"transform-history","schema":"oan.hopng_transform_history","schemaVersion":"0.1.0"},{"path":"phase2-sample.depth-field.json","required":true,"role":"depth-field","schema":"oan.hopng_depth_field","schemaVersion":"0.1.0"},{"path":"phase2-sample.hash.json","required":true,"role":"hash","schema":"oan.hopng_hash_set","schemaVersion":"0.1.0"},{"path":"phase2-sample.signature.json","required":true,"role":"signature","schema":"oan.hopng_signature","schemaVersion":"0.1.0"},{"path":"phase2-sample.universe-layer.json","required":true,"role":"universe-layer","schema":"oan.hopng_universe_layer","schemaVersion":"0.1.0"},{"path":"phase2-sample.gluing-manifest.json","required":true,"role":"gluing-manifest","schema":"oan.hopng_gluing_manifest","schemaVersion":"0.1.0"},{"path":"phase2-sample.projection-rules.json","required":true,"role":"projection-rules","schema":"oan.hopng_projection_rules","schemaVersion":"0.1.0"},{"path":"phase2-sample.legibility-profile.json","required":true,"role":"legibility-profile","schema":"oan.hopng_legibility_profile","schemaVersion":"0.1.0"}],"visibilityPolicy":{"approvedMetadataFields":["artifactId","displayName","createdUtc","projectionFile"],"crypticPointersAllowed":true,"crypticReferences":[],"machineReadableLayersAllowed":true,"primeSafeProjection":true}}