{"artifactId":"e4b06156-a3a2-428c-bafa-bd12fd0be848","createdUtc":"2026-03-30T17:13:57.1788545\u002B00:00","displayName":"phase4-participatory-sample","fileDigests":[{"path":"phase4-participatory-sample.png","role":"projection","sha256":"c84bbe2f061783b3c40b8ae23b05afc2eaf0665ef80b7d4e703a2f9bffa2d0ca"},{"path":"phase4-participatory-sample.layer-map.json","role":"layer-map","sha256":"64123f3e5616678ed240879a3c320f060ef52376b32ebb568d3887062c2e1c68"},{"path":"phase4-participatory-sample.trust-envelope.json","role":"trust-envelope","sha256":"ff619a4890539e4273f756b32fab6f9df7ad9c9fb18ddf0d72a141c53bc97804"},{"path":"phase4-participatory-sample.transform-history.json","role":"transform-history","sha256":"7c36d3895a9a11cf5d582b4e9177363f0423b81b1336d0b6cb8afbe6cd08e3c9"},{"path":"phase4-participatory-sample.depth-field.json","role":"depth-field","sha256":"fb24c91654dd35d2323825f3e065ef7b5163fb8f1e9c646838a7af64e1f3ff98"},{"path":"phase4-participatory-sample.universe-layer.json","role":"universe-layer","sha256":"35e7fc50cec79a841200d835066676c628cf2e320008d0a589d6422306a4a24e"},{"path":"phase4-participatory-sample.gluing-manifest.json","role":"gluing-manifest","sha256":"dc8d1da132d8b10c6c1039426d44303eb94529d594c8c33bd867f8ff1f27b5fc"},{"path":"phase4-participatory-sample.projection-rules.json","role":"projection-rules","sha256":"652294783133a062f34ec4d8f4064ac8790155efe8a48c5545ee39404ddba818"},{"path":"phase4-participatory-sample.legibility-profile.json","role":"legibility-profile","sha256":"0b00acd61a437e09ad508d85891224734b0196fc21bc1f3d51e1f291cb115da2"},{"path":"phase4-participatory-sample.event-slices.json","role":"event-slices","sha256":"922b9d16d45de0bd19c94ac976c092d1029b812a297148992aa7365b766f4c29"},{"path":"phase4-participatory-sample.phase-slices.json","role":"phase-slices","sha256":"0396f2b3c5402d3a53800497b99cdd9fc75c7c6a5ba7fb60424ca2632075411a"},{"path":"phase4-participatory-sample.phase-policy.json","role":"phase-policy","sha256":"ad0e86ecfc9fa4f275804925509bc1427b0cf23f701c89bb41e9d254db6b13d4"},{"path":"phase4-participatory-sample.optical-channels.json","role":"optical-channels","sha256":"80a073e3cc6097cc6275a4e0a7d755a9ccc51b13a3f6a7bc87afd113b5079e1c"},{"path":"phase4-participatory-sample.participatory-engram.json","role":"participatory-engram","sha256":"866975da06f775e79fc43a0111d9e421651e592996f7cd550e3200258cfbcbab"}],"phaseReservations":["oan.hopng_peral_universe_set","oan.hopng_modal_transform","oan.hopng_formation_contract","oan.identity_review_delta","oan.cert_acceptance_record","oan.module_self_base_set","oan.commitment_projection","oan.role_glyphic_act","oan.oe_chain_boundary","oan.hopng_role_header","oan.hopng_role_endcap"],"projectionFile":"phase4-participatory-sample.png","schema":"oan.hopng_manifest","schemaVersion":"0.1.0","sidecars":[{"path":"phase4-participatory-sample.layer-map.json","required":true,"role":"layer-map","schema":"oan.hopng_layer_map","schemaVersion":"0.1.0"},{"path":"phase4-participatory-sample.trust-envelope.json","required":true,"role":"trust-envelope","schema":"oan.hopng_trust_envelope","schemaVersion":"0.1.0"},{"path":"phase4-participatory-sample.transform-history.json","required":true,"role":"transform-history","schema":"oan.hopng_transform_history","schemaVersion":"0.1.0"},{"path":"phase4-participatory-sample.depth-field.json","required":true,"role":"depth-field","schema":"oan.hopng_depth_field","schemaVersion":"0.1.0"},{"path":"phase4-participatory-sample.hash.json","required":true,"role":"hash","schema":"oan.hopng_hash_set","schemaVersion":"0.1.0"},{"path":"phase4-participatory-sample.signature.json","required":true,"role":"signature","schema":"oan.hopng_signature","schemaVersion":"0.1.0"},{"path":"phase4-participatory-sample.universe-layer.json","required":true,"role":"universe-layer","schema":"oan.hopng_universe_layer","schemaVersion":"0.1.0"},{"path":"phase4-participatory-sample.gluing-manifest.json","required":true,"role":"gluing-manifest","schema":"oan.hopng_gluing_manifest","schemaVersion":"0.1.0"},{"path":"phase4-participatory-sample.projection-rules.json","required":true,"role":"projection-rules","schema":"oan.hopng_projection_rules","schemaVersion":"0.1.0"},{"path":"phase4-participatory-sample.legibility-profile.json","required":true,"role":"legibility-profile","schema":"oan.hopng_legibility_profile","schemaVersion":"0.1.0"},{"path":"phase4-participatory-sample.event-slices.json","required":true,"role":"event-slices","schema":"oan.hopng_event_slice","schemaVersion":"0.1.0"},{"path":"phase4-participatory-sample.phase-slices.json","required":true,"role":"phase-slices","schema":"oan.hopng_phase_slice","schemaVersion":"0.1.0"},{"path":"phase4-participatory-sample.phase-policy.json","required":true,"role":"phase-policy","schema":"oan.hopng_phase_policy","schemaVersion":"0.1.0"},{"path":"phase4-participatory-sample.optical-channels.json","required":true,"role":"optical-channels","schema":"oan.hopng_optical_channels","schemaVersion":"0.1.0"},{"path":"phase4-participatory-sample.participatory-engram.json","required":true,"role":"participatory-engram","schema":"oan.hopng_participatory_engram","schemaVersion":"0.1.0"}],"visibilityPolicy":{"approvedMetadataFields":["artifactId","displayName","createdUtc","projectionFile"],"crypticPointersAllowed":true,"crypticReferences":[],"machineReadableLayersAllowed":true,"primeSafeProjection":true}}