{"artifactId":"f196120c-0fed-4d44-944c-0da60949710a","createdUtc":"2026-03-30T07:50:29.6923219\u002B00:00","displayName":"phase3-divergent-peer","fileDigests":[{"path":"phase3-divergent-peer.png","role":"projection","sha256":"c84bbe2f061783b3c40b8ae23b05afc2eaf0665ef80b7d4e703a2f9bffa2d0ca"},{"path":"phase3-divergent-peer.layer-map.json","role":"layer-map","sha256":"0eb205980d770f4142acadaa22ff1f2ab0f6c58733bbc54685c41f60038f8523"},{"path":"phase3-divergent-peer.trust-envelope.json","role":"trust-envelope","sha256":"e21967ae0308e231929c6485fe9c92b67b6023b3b39e6babf871ce9b26ac3a92"},{"path":"phase3-divergent-peer.transform-history.json","role":"transform-history","sha256":"fb58c8c45f9afe85a6ba6830c133b5187bf4d60475dfd3959a1ffbf2ae90e0a2"},{"path":"phase3-divergent-peer.depth-field.json","role":"depth-field","sha256":"da91496428a02da42db8fc50352f1acb17ac223529cb46d977705387a1ba3a0e"},{"path":"phase3-divergent-peer.universe-layer.json","role":"universe-layer","sha256":"f16243b903ff901165070173cf55552b97138b89258a77fbb5c143591ff14077"},{"path":"phase3-divergent-peer.gluing-manifest.json","role":"gluing-manifest","sha256":"3edbd3d18ed86a7bc15f3bee53747f501b48c68233a498810253c4bb4a117d18"},{"path":"phase3-divergent-peer.projection-rules.json","role":"projection-rules","sha256":"67e23ae4d87369776075ee116c2e4e9ca172d166d4842168dcf13c3acbc88b15"},{"path":"phase3-divergent-peer.legibility-profile.json","role":"legibility-profile","sha256":"83a438d61ffb89236ad2cde6c552e97b008bc72ea3b700a5c4df8f0fc6b4fd67"},{"path":"phase3-divergent-peer.event-slices.json","role":"event-slices","sha256":"c485d86eead3ffdd3da7b64d2d286d91419cd0e2dcc449f4e3eb40cd35e20042"},{"path":"phase3-divergent-peer.phase-slices.json","role":"phase-slices","sha256":"f32614b40f1f7fa3047c40488210117e5f661004e828e389ff4d28d0f80d9783"},{"path":"phase3-divergent-peer.phase-policy.json","role":"phase-policy","sha256":"7eae3ae1416198371327e0f5d2f76b57674239a7755f10994d195102bf2081ac"},{"path":"phase3-divergent-peer.optical-channels.json","role":"optical-channels","sha256":"583a2cfa7fc7ce8d9d19c4b57a6f608025c7b499a39ba3dc271f16c1ab91aafd"}],"phaseReservations":["oan.hopng_perspectival_engram","oan.hopng_participatory_engram","oan.hopng_peral_universe_set","oan.hopng_modal_transform","oan.hopng_formation_contract","oan.identity_review_delta","oan.cert_acceptance_record","oan.module_self_base_set","oan.commitment_projection","oan.role_glyphic_act","oan.oe_chain_boundary","oan.hopng_role_header","oan.hopng_role_endcap"],"projectionFile":"phase3-divergent-peer.png","schema":"oan.hopng_manifest","schemaVersion":"0.1.0","sidecars":[{"path":"phase3-divergent-peer.layer-map.json","required":true,"role":"layer-map","schema":"oan.hopng_layer_map","schemaVersion":"0.1.0"},{"path":"phase3-divergent-peer.trust-envelope.json","required":true,"role":"trust-envelope","schema":"oan.hopng_trust_envelope","schemaVersion":"0.1.0"},{"path":"phase3-divergent-peer.transform-history.json","required":true,"role":"transform-history","schema":"oan.hopng_transform_history","schemaVersion":"0.1.0"},{"path":"phase3-divergent-peer.depth-field.json","required":true,"role":"depth-field","schema":"oan.hopng_depth_field","schemaVersion":"0.1.0"},{"path":"phase3-divergent-peer.hash.json","required":true,"role":"hash","schema":"oan.hopng_hash_set","schemaVersion":"0.1.0"},{"path":"phase3-divergent-peer.signature.json","required":true,"role":"signature","schema":"oan.hopng_signature","schemaVersion":"0.1.0"},{"path":"phase3-divergent-peer.universe-layer.json","required":true,"role":"universe-layer","schema":"oan.hopng_universe_layer","schemaVersion":"0.1.0"},{"path":"phase3-divergent-peer.gluing-manifest.json","required":true,"role":"gluing-manifest","schema":"oan.hopng_gluing_manifest","schemaVersion":"0.1.0"},{"path":"phase3-divergent-peer.projection-rules.json","required":true,"role":"projection-rules","schema":"oan.hopng_projection_rules","schemaVersion":"0.1.0"},{"path":"phase3-divergent-peer.legibility-profile.json","required":true,"role":"legibility-profile","schema":"oan.hopng_legibility_profile","schemaVersion":"0.1.0"},{"path":"phase3-divergent-peer.event-slices.json","required":true,"role":"event-slices","schema":"oan.hopng_event_slice","schemaVersion":"0.1.0"},{"path":"phase3-divergent-peer.phase-slices.json","required":true,"role":"phase-slices","schema":"oan.hopng_phase_slice","schemaVersion":"0.1.0"},{"path":"phase3-divergent-peer.phase-policy.json","required":true,"role":"phase-policy","schema":"oan.hopng_phase_policy","schemaVersion":"0.1.0"},{"path":"phase3-divergent-peer.optical-channels.json","required":true,"role":"optical-channels","schema":"oan.hopng_optical_channels","schemaVersion":"0.1.0"}],"visibilityPolicy":{"approvedMetadataFields":["artifactId","displayName","createdUtc","projectionFile"],"crypticPointersAllowed":true,"crypticReferences":[],"machineReadableLayersAllowed":true,"primeSafeProjection":true}}